{
  "headline": "NMC guidance on child obesity drugs hit Halden Pharma, while a US probe hung over Corvex.",
  "market_macro": "The S&P 500 rose 0.2% to 6120.4 and the FTSE All-World gained 0.3%, leaving both up less than 1% over the month. Rates set the tone. The US 10-year yield reached 5.2%, 45 basis points higher in a month, and the 2s10s curve stood at 46 basis points. The Euro Stoxx 50 put/call ratio rose to 1.24, against a 1-month average of 1.11. Headlines had Treasury yields rising despite a weak jobs report and Fed officials weighing a pause against another rate rise.\n\nThe froth score is 46.8, in the balanced band, and its velocity is stable. No pillar is stretched: valuation (26.8), positioning (25.9) and liquidity (37.5) are all calm. The regime reads risk on, on a 12-month index return of 14.6% and a curve that is not inverted. More put buying on the Euro Stoxx 50 is the one sign of investors adding protection.",
  "top_stories": [
    {
      "ticker": "HLDN",
      "title": "Halden Pharma extends pullback",
      "body": "Halden Pharma fell 3.4% on the day, about twice its normal daily swing, and is now down 7.5% over the week and 7.3% over the month. The model still reads the stock as cheap on a 12.2x price-to-earnings multiple and treats the pullback as mild. It remains a hold, with 67% confidence.",
      "sources": []
    },
    {
      "ticker": "CRVX",
      "title": "Corvex edges lower",
      "body": "Corvex slipped 0.03% on the day and is down 4.45% over the week. The model reads the valuation as reasonable at 23.5x earnings and sees no shock in the headlines. It remains a hold, with 55% confidence.",
      "sources": []
    },
    {
      "ticker": "LNDQ",
      "title": "Bond refinancing at a 3.25% coupon",
      "body": "Lindqvist rose 2.2%, about 1.3x a normal day, and is up 4.1% over the week. No company news explains the size of the move. The only item in the period is a refinancing: Reuters reported on 6 Oct that the cable maker completed a 500 million euro bond maturing in 2033 with a 3.25% coupon, to refinance existing debt. Locking in seven-year money at that rate lengthens the debt profile and removes a funding question, though it does not change the operating story. The shares carry a high multiple, and the model reads them as expensive at 177.7x earnings. That keeps it at a low-conviction hold, with confidence of 28%, on a watchlist name whose price has gone nowhere over the month. The coupon on any further issuance will show what lenders charge the company for longer-dated funding.",
      "sources": [
        {
          "source": "RTRS",
          "date": "2026-10-06",
          "headline": "BRIEF-Lindqvist Completes EUR 500 Mln Bond Issuance"
        }
      ]
    }
  ],
  "earnings_watch": [],
  "closest_to_changing": [
    {
      "ticker": "HRBR",
      "title": "Close to a buy signal",
      "body": "Harbour Bancorp's composite score of 0.142 sits 0.108 below the 0.25 buy threshold, so its 1-month trend of -2.5% would have to turn up for the signal to change."
    }
  ]
}
